{
  "analysis_config": {
    "aggregate_weighting": "equal_weight_per_dataset_model_stratum",
    "confidence_interval": {
      "level": 0.95,
      "method": "paired_stratified_percentile_bootstrap",
      "resamples": 10000,
      "seed": 20260812
    },
    "hypothesis_test": {
      "alpha": 0.05,
      "exact_max_nonzero_pairs": 20,
      "familywise_correction": "holm_for_H1_and_H2_FANU_tests",
      "method": "two_sided_paired_permutation",
      "monte_carlo_draws": 100000,
      "monte_carlo_pvalue": "add_one_correction",
      "seed": 20260812
    },
    "paired_block_keys": [
      "dataset_id",
      "model_id",
      "replicate_index"
    ],
    "schema_version": "1.0",
    "valid_submission_rate_interval": {
      "level": 0.95,
      "method": "wilson_score"
    },
    "valid_submission_test": "exact_mcnemar"
  },
  "analysis_config_hash": "b6c081765c17ae483f0e150a4f214138ddaa0a8b3da28b9e40d2695bde41673f",
  "analysis_reference_hash": "e867776aa650b7445a9fb17d16686e176dca8b14cc0c1460426708fe162e0570",
  "comparisons": {
    "H1": {
      "bootstrap_ci": {
        "high": -0.6086967722665364,
        "low": -0.8483602141482327
      },
      "control": "A",
      "control_mean_fanu": 0.8935775521757232,
      "control_median_fanu": 0.9784129314257295,
      "dataset_model_summaries": [
        {
          "control_mean_fanu": 0.0,
          "dataset_id": "air_quality",
          "mean_paired_difference": 0.18137871441250245,
          "median_paired_difference": 0.0,
          "model_id": "deepseek-v4-flash",
          "pair_count": 5,
          "treatment_mean_fanu": 0.18137871441250245
        },
        {
          "control_mean_fanu": 0.0,
          "dataset_id": "air_quality",
          "mean_paired_difference": 0.0,
          "median_paired_difference": 0.0,
          "model_id": "gemma-4-26b",
          "pair_count": 5,
          "treatment_mean_fanu": 0.0
        },
        {
          "control_mean_fanu": 1.6976615149368155,
          "dataset_id": "bank_marketing",
          "mean_paired_difference": -1.6976615149368155,
          "median_paired_difference": -1.6976615149368155,
          "model_id": "deepseek-v4-flash",
          "pair_count": 5,
          "treatment_mean_fanu": 0.0
        },
        {
          "control_mean_fanu": 1.5276779184663842,
          "dataset_id": "bank_marketing",
          "mean_paired_difference": -1.0132574639620564,
          "median_paired_difference": -1.359623347288968,
          "model_id": "gemma-4-26b",
          "pair_count": 5,
          "treatment_mean_fanu": 0.5144204545043278
        },
        {
          "control_mean_fanu": 0.973191377409194,
          "dataset_id": "diabetes_readmission",
          "mean_paired_difference": -0.973191377409194,
          "median_paired_difference": -0.9744909677683239,
          "model_id": "deepseek-v4-flash",
          "pair_count": 5,
          "treatment_mean_fanu": 0.0
        },
        {
          "control_mean_fanu": 0.9828609352014342,
          "dataset_id": "diabetes_readmission",
          "mean_paired_difference": -0.5797396092697443,
          "median_paired_difference": -0.9574015344600557,
          "model_id": "gemma-4-26b",
          "pair_count": 5,
          "treatment_mean_fanu": 0.40312132593169
        },
        {
          "control_mean_fanu": 0.9804247444552027,
          "dataset_id": "student_dropout",
          "mean_paired_difference": -0.9804247444552027,
          "median_paired_difference": -0.9871073680754352,
          "model_id": "deepseek-v4-flash",
          "pair_count": 5,
          "treatment_mean_fanu": 0.0
        },
        {
          "control_mean_fanu": 0.9868039269367551,
          "dataset_id": "student_dropout",
          "mean_paired_difference": -0.7860951440220446,
          "median_paired_difference": -0.9784129314257295,
          "model_id": "gemma-4-26b",
          "pair_count": 5,
          "treatment_mean_fanu": 0.20070878291471045
        }
      ],
      "equal_stratum_mean_difference": -0.7311238924553194,
      "hypothesis_id": "H1",
      "median_paired_difference": -0.9734774756557191,
      "pair_count": 40,
      "pairs": [
        {
          "control_arm": "A",
          "control_fanu": 0.0,
          "control_valid": false,
          "dataset_id": "air_quality",
          "difference": 0.0,
          "model_id": "deepseek-v4-flash",
          "replicate_index": 0,
          "treatment_arm": "B",
          "treatment_fanu": 0.0,
          "treatment_valid": false
        },
        {
          "control_arm": "A",
          "control_fanu": 0.0,
          "control_valid": false,
          "dataset_id": "air_quality",
          "difference": 0.0,
          "model_id": "deepseek-v4-flash",
          "replicate_index": 1,
          "treatment_arm": "B",
          "treatment_fanu": 0.0,
          "treatment_valid": false
        },
        {
          "control_arm": "A",
          "control_fanu": 0.0,
          "control_valid": false,
          "dataset_id": "air_quality",
          "difference": 0.9068935720625122,
          "model_id": "deepseek-v4-flash",
          "replicate_index": 2,
          "treatment_arm": "B",
          "treatment_fanu": 0.9068935720625122,
          "treatment_valid": true
        },
        {
          "control_arm": "A",
          "control_fanu": 0.0,
          "control_valid": false,
          "dataset_id": "air_quality",
          "difference": 0.0,
          "model_id": "deepseek-v4-flash",
          "replicate_index": 3,
          "treatment_arm": "B",
          "treatment_fanu": 0.0,
          "treatment_valid": false
        },
        {
          "control_arm": "A",
          "control_fanu": 0.0,
          "control_valid": false,
          "dataset_id": "air_quality",
          "difference": 0.0,
          "model_id": "deepseek-v4-flash",
          "replicate_index": 4,
          "treatment_arm": "B",
          "treatment_fanu": 0.0,
          "treatment_valid": false
        },
        {
          "control_arm": "A",
          "control_fanu": 0.0,
          "control_valid": false,
          "dataset_id": "air_quality",
          "difference": 0.0,
          "model_id": "gemma-4-26b",
          "replicate_index": 0,
          "treatment_arm": "B",
          "treatment_fanu": 0.0,
          "treatment_valid": false
        },
        {
          "control_arm": "A",
          "control_fanu": 0.0,
          "control_valid": false,
          "dataset_id": "air_quality",
          "difference": 0.0,
          "model_id": "gemma-4-26b",
          "replicate_index": 1,
          "treatment_arm": "B",
          "treatment_fanu": 0.0,
          "treatment_valid": false
        },
        {
          "control_arm": "A",
          "control_fanu": 0.0,
          "control_valid": false,
          "dataset_id": "air_quality",
          "difference": 0.0,
          "model_id": "gemma-4-26b",
          "replicate_index": 2,
          "treatment_arm": "B",
          "treatment_fanu": 0.0,
          "treatment_valid": false
        },
        {
          "control_arm": "A",
          "control_fanu": 0.0,
          "control_valid": false,
          "dataset_id": "air_quality",
          "difference": 0.0,
          "model_id": "gemma-4-26b",
          "replicate_index": 3,
          "treatment_arm": "B",
          "treatment_fanu": 0.0,
          "treatment_valid": false
        },
        {
          "control_arm": "A",
          "control_fanu": 0.0,
          "control_valid": false,
          "dataset_id": "air_quality",
          "difference": 0.0,
          "model_id": "gemma-4-26b",
          "replicate_index": 4,
          "treatment_arm": "B",
          "treatment_fanu": 0.0,
          "treatment_valid": false
        },
        {
          "control_arm": "A",
          "control_fanu": 1.6976615149368155,
          "control_valid": true,
          "dataset_id": "bank_marketing",
          "difference": -1.6976615149368155,
          "model_id": "deepseek-v4-flash",
          "replicate_index": 0,
          "treatment_arm": "B",
          "treatment_fanu": 0.0,
          "treatment_valid": false
        },
        {
          "control_arm": "A",
          "control_fanu": 1.6976615149368155,
          "control_valid": true,
          "dataset_id": "bank_marketing",
          "difference": -1.6976615149368155,
          "model_id": "deepseek-v4-flash",
          "replicate_index": 1,
          "treatment_arm": "B",
          "treatment_fanu": 0.0,
          "treatment_valid": false
        },
        {
          "control_arm": "A",
          "control_fanu": 1.4478970222362666,
          "control_valid": true,
          "dataset_id": "bank_marketing",
          "difference": -1.4478970222362666,
          "model_id": "deepseek-v4-flash",
          "replicate_index": 2,
          "treatment_arm": "B",
          "treatment_fanu": 0.0,
          "treatment_valid": false
        },
        {
          "control_arm": "A",
          "control_fanu": 1.9474260076373642,
          "control_valid": true,
          "dataset_id": "bank_marketing",
          "difference": -1.9474260076373642,
          "model_id": "deepseek-v4-flash",
          "replicate_index": 3,
          "treatment_arm": "B",
          "treatment_fanu": 0.0,
          "treatment_valid": false
        },
        {
          "control_arm": "A",
          "control_fanu": 1.6976615149368155,
          "control_valid": true,
          "dataset_id": "bank_marketing",
          "difference": -1.6976615149368155,
          "model_id": "deepseek-v4-flash",
          "replicate_index": 4,
          "treatment_arm": "B",
          "treatment_fanu": 0.0,
          "treatment_valid": false
        },
        {
          "control_arm": "A",
          "control_fanu": 1.8497460829638908,
          "control_valid": true,
          "dataset_id": "bank_marketing",
          "difference": -1.8497460829638908,
          "model_id": "gemma-4-26b",
          "replicate_index": 0,